"literatos","profundos","1","2","","","92","True","92","3","3295","3295","white","yes","EyeLogicOne","0","341","0.14","psycho",".","8","1405","Muchos de los profundos secretos de la naturaleza siguen siendo desconocidos para nosotros.","psycho","psycho","0","relative","1","","undefined","1","","undefined","None","51","51","51","0","51","0","52","0","51","51","0","0","0","0","0","51","0","0","51","51","NA","0","0","0","0","51","51","0","51","51","0","0","0","0","0","51","51","0","51","b2","","","Muchos de los profundos secretos de la naturaleza siguen siendo desconocidos para nosotros.","Muchos de los profundos secretos de la naturaleza siguen siendo desconocidos para nosotros.","Fri Apr 17 16:45:30 2026","Sampling rate","250","False","Sí","EyeLogic_Experiment_ONE.osexp","C:\Users\LabCINC\Documents\Experiments\eyelogicreading\ONE","25","M","21","0","1","382848.72170000745","False","Courier New","False","24","no","black","no","Sí","high","yes","50","50","NO","1080","12","175","NO","16","None","psycho","91","78","36","46","4","0","C:\Users\LabCINC\Documents\Experiments\eyelogicreading\ONE\subject-5.csv","psycho","13","1","Neonatal Nightingale","4.1.8","Muchos de los ","3","2","yes","0","1","NA","2","1","1","NA","2","NA","1716.8489000032423","NA","6518.167799993535","14714.407099992968","1716.8489000032423","NA","7493.552200001432","NA","1405","2","psycho","Muchos de los profundos secretos de la naturaleza siguen siendo desconocidos para nosotros.","Muchos de los ","Muchos de los profundos secretos de la naturaleza siguen siendo desconocidos para nosotros.","Muchos de los profundos secretos de la naturaleza siguen siendo desconocidos para nosotros.","121","Muchos de los literatos clásicos han influenciado la literatura contemporánea.","70","125.0","Muchos de los profundos secretos de la naturaleza siguen siendo desconocidos para nosotros.","1024","2","48000","-16","experiment","1","5","odd","378402.55729999626","380012.87249999586","382848.63730000507","380271.15179999964","profundos","3","False","121","378402.45629999845","380271.12849999685","378224.8130999942","NA","315983.0942999979","97531.4636999974","382954.94039999903","39199.98000000487","380262.98070000485","378224.8533999955","NA","91012.27110000036","6157.073599999421","97531.55519999564","97531.07440000167","376663.8746999961","6157.344100007322","10039.009900006931","315984.63049999555","382954.9941000005","NA","46739.06970000826","39245.056300002034","39200.04359999439","39237.601900007576","378224.82760000275","378224.8452000058","24759.80860000709","378224.86489999574","377366.6444999981","NA","NA","NA","NA","8580.585600007907","378224.8366999993","378395.6176000065","NA","378224.7347999946","Sampling_Rate_Experiment","12","42847.778199997265","13","1","1","experimental","250","100","no","1920","nosotros.","12","1817.039542476668","100","1728.0","150","985.8574740797018","565.0","515.0","972.0"
"rompían","dejaban","1","2","","","92","True","92","3","3295","3295","white","yes","EyeLogicOne","0","369","0.14","psycho",".","11","1181","A menudo, ellos rompían cosas accidentalmente y se disculpaban rápidamente.","psycho","psycho","0","relative","1","","undefined","1","","undefined","None","52","52","52","0","52","0","53","0","52","52","0","0","0","0","0","52","0","0","52","52","NA","0","0","0","0","52","52","0","52","52","0","0","0","0","0","52","52","0","52","b2","","","A menudo, ellos rompían cosas accidentalmente y se disculpaban rápidamente.","A menudo, ellos rompían cosas accidentalmente y se disculpaban rápidamente.","Fri Apr 17 16:45:30 2026","Sampling rate","250","False","Sí","EyeLogic_Experiment_ONE.osexp","C:\Users\LabCINC\Documents\Experiments\eyelogicreading\ONE","25","A","21","0","1","388807.1506999986","False","Courier New","False","24","no","black","no","Sí","low","yes","50","50","NO","1080","9","188","NO","274","None","psycho","46","75","36","47","4","0","C:\Users\LabCINC\Documents\Experiments\eyelogicreading\ONE\subject-5.csv","psycho","10","1","Neonatal Nightingale","4.1.8","A menudo, ellos","3","2","yes","0","1","NA","2","1","1","NA","2","NA","1716.8489000032423","NA","6518.167799993535","14714.407099992968","1716.8489000032423","NA","7493.552200001432","NA","1181","2","psycho","A menudo, ellos rompían cosas accidentalmente y se disculpaban rápidamente.","A menudo, ellos","A menudo, ellos rompían cosas accidentalmente y se disculpaban rápidamente.","A menudo, ellos dejaban todo para última hora.","121","A menudo, ellos rompían cosas accidentalmente y se disculpaban rápidamente.","149","125.0","A menudo, ellos rompían cosas accidentalmente y se disculpaban rápidamente.","1024","2","48000","-16","experiment","1","5","odd","384600.9916000039","385547.72180000145","388807.0707000006","385805.41030000313","rompían","3","False","121","384600.89410000364","385805.33119999745","384409.10180000355","NA","315983.0942999979","97531.4636999974","388913.0776999955","39199.98000000487","385797.85339999944","384409.14299999713","NA","91012.27110000036","6157.073599999421","97531.55519999564","97531.07440000167","382964.75759999885","6157.344100007322","10039.009900006931","315984.63049999555","388913.1366000074","NA","46739.06970000826","39245.056300002034","39200.04359999439","39237.601900007576","384409.1163999983","384409.1347000067","24759.80860000709","384409.15510000195","383671.98420000204","NA","NA","NA","NA","8580.585600007907","384409.12599999865","384593.89750000264","NA","384409.02419999475","Sampling_Rate_Experiment","12","42847.778199997265","13","1","1","experimental","250","100","no","1920","rápidamente.","9","1846.7090499857022","100","1728.0","150","984.7876124974024","565.0","515.0","972.0"
"observe","apruebe","1","2","","","92","True","92","3","3295","3295","white","yes","EyeLogicOne","0","353","0.14","psycho",".","6","843","Le sugiero que apruebe la propuesta sin más demora.","psycho","psycho","0","relative","1","","undefined","1","","undefined","None","53","53","53","0","53","0","54","0","53","53","0","0","0","0","0","53","0","0","53","53","NA","0","0","0","0","53","53","0","53","53","0","0","0","0","0","53","53","0","53","b2","","","Le sugiero que apruebe la propuesta sin más demora.","Le sugiero que apruebe la propuesta sin más demora.","Fri Apr 17 16:45:30 2026","Sampling rate","250","False","Sí","EyeLogic_Experiment_ONE.osexp","C:\Users\LabCINC\Documents\Experiments\eyelogicreading\ONE","25","L","19","0","1","394453.8063000073","False","Courier New","False","24","no","black","no","Sí","high","yes","50","50","NO","1080","8","134","NO","287","None","psycho","51","78","36","48","4","0","C:\Users\LabCINC\Documents\Experiments\eyelogicreading\ONE\subject-5.csv","psycho","9","1","Neonatal Nightingale","4.1.8","Le sugiero que ","3","2","yes","0","1","NA","2","1","1","NA","2","NA","1716.8489000032423","NA","6518.167799993535","14714.407099992968","1716.8489000032423","NA","7493.552200001432","NA","843","2","psycho","Le sugiero que apruebe la propuesta sin más demora.","Le sugiero que ","Le sugiero que apruebe la propuesta sin más demora.","Le sugiero que apruebe la propuesta sin más demora.","119","Le sugiero que observe detenidamente la situación antes de tomar una decisión.","100","125.0","Le sugiero que apruebe la propuesta sin más demora.","1024","2","48000","-16","experiment","1","5","odd","390304.04499999713","390802.019499999","394453.72489999863","391060.6107000058","apruebe","3","False","119","390303.88890000177","391060.5859000061","390121.49299999874","NA","315983.0942999979","97531.4636999974","394559.85269999655","39199.98000000487","391052.15839999437","390121.5324999939","NA","91012.27110000036","6157.073599999421","97531.55519999564","97531.07440000167","388921.470900008","6157.344100007322","10039.009900006931","315984.63049999555","394559.90900000324","NA","46739.06970000826","39245.056300002034","39200.04359999439","39237.601900007576","390121.50649999967","390121.5242000035","24759.80860000709","390121.54390000796","389630.3045999957","NA","NA","NA","NA","8580.585600007907","390121.51569999696","390296.3199000078","NA","390121.4234000072","Sampling_Rate_Experiment","12","42847.778199997265","13","1","1","experimental","250","100","no","1920","demora.","8","1856.5124819032415","100","1728.0","150","1000.4936590003217","565.0","515.0","972.0"
"actuaban","contaban","1","2","","","92","True","92","3","3295","3295","white","yes","EyeLogicOne","0","662","0.14","psycho",".","10","1208","En la obra de teatro, los personajes contaban chistes y anécdotas divertidas.","psycho","psycho","0","relative","1","","undefined","1","","undefined","None","54","54","54","0","54","0","55","0","54","54","0","0","0","0","0","54","0","0","54","54","NA","0","0","0","0","54","54","0","54","54","0","0","0","0","0","54","54","0","54","b2","","","En la obra de teatro, los personajes contaban chistes y anécdotas divertidas.","En la obra de teatro, los personajes contaban chistes y anécdotas divertidas.","Fri Apr 17 16:45:30 2026","Sampling rate","250","False","Sí","EyeLogic_Experiment_ONE.osexp","C:\Users\LabCINC\Documents\Experiments\eyelogicreading\ONE","25","E","20","0","1","399362.86789999576","False","Courier New","False","24","no","black","no","Sí","high","yes","50","50","NO","1080","11","139","NO","153","None","psycho","77","74","36","49","4","0","C:\Users\LabCINC\Documents\Experiments\eyelogicreading\ONE\subject-5.csv","psycho","12","1","Neonatal Nightingale","4.1.8","En la obra de teatro, los personajes ","7","2","yes","0","1","NA","2","1","1","NA","2","NA","1716.8489000032423","NA","6518.167799993535","14714.407099992968","1716.8489000032423","NA","7493.552200001432","NA","1208","2","psycho","En la obra de teatro, los personajes contaban chistes y anécdotas divertidas.","En la obra de teatro, los personajes ","En la obra de teatro, los personajes contaban chistes y anécdotas divertidas.","En la obra de teatro, los personajes contaban chistes y anécdotas divertidas.","120","En la obra de teatro, los personajes actuaban de forma exagerada y cómica.","132","125.0","En la obra de teatro, los personajes contaban chistes y anécdotas divertidas.","1024","2","48000","-16","experiment","1","5","odd","396166.9649999967","396642.7197000012","399362.77799999516","396900.3517999954","contaban","7","False","120","396166.86719999416","396900.3254999989","395988.0654000008","NA","315983.0942999979","97531.4636999974","399468.9250000083","39199.98000000487","396892.92650000425","395988.105299999","NA","91012.27110000036","6157.073599999421","97531.55519999564","97531.07440000167","394568.1959000067","6157.344100007322","10039.009900006931","315984.63049999555","399468.9783000067","NA","46739.06970000826","39245.056300002034","39200.04359999439","39237.601900007576","395988.0808000016","395988.0974999978","24759.80860000709","395988.11730000307","395273.8501999993","NA","NA","NA","NA","8580.585600007907","395988.0897999974","396160.26489999786","NA","395987.96729999594","Sampling_Rate_Experiment","12","42847.778199997265","13","1","1","experimental","250","100","no","1920","divertidas.","11","1866.9265888481095","100","1728.0","150","1015.0408105881772","565.0","515.0","972.0"
"registraba","permanecía","1","2","¿Estaba el sistema disponible para su uso inmediato tras el acceso?","¿Guardaba la aplicación datos sobre el momento y lugar de entrada?","92","True","92","3","3212","3212","white","yes","EyeLogicOne","0","675","0.14","psycho",".","6","1305","Cada vez que ingresábamos, el sistema registraba nuestra ubicación y hora de acceso.","psycho","psycho","0","relative","1","NO","undefined","1","YES","undefined","1","55","55","55","0","55","0","56","0","55","55","0","0","0","0","0","55","0","0","55","55","NA","0","0","0","0","55","55","0","55","55","0","0","0","0","0","55","55","0","55","b2","YES","¿Guardaba la aplicación datos sobre el momento y lugar de entrada?","Cada vez que ingresábamos, el sistema registraba nuestra ubicación y hora de acceso.","Cada vez que ingresábamos, el sistema registraba nuestra ubicación y hora de acceso.","Fri Apr 17 16:45:30 2026","Sampling rate","250","False","Sí","EyeLogic_Experiment_ONE.osexp","C:\Users\LabCINC\Documents\Experiments\eyelogicreading\ONE","25","C","19","0","1","404802.5059000065","False","Courier New","False","24","no","black","no","Sí","low","yes","50","50","YES","1080","12","114","YES","473","None","psycho","75","84","36","50","4","0","C:\Users\LabCINC\Documents\Experiments\eyelogicreading\ONE\subject-5.csv","psycho","13","1","Neonatal Nightingale","4.1.8","Cada vez que ingresábamos, el sistema ","6","2","yes","0","1","NA","2","1","1","NA","2","NA","2125.9556000004523","NA","6518.167799993535","14714.407099992968","2125.9556000004523","NA","7493.552200001432","NA","1305","2","psycho","Cada vez que ingresábamos, el sistema registraba nuestra ubicación y hora de acceso.","Cada vez que ingresábamos, el sistema ","Cada vez que ingresábamos, el sistema registraba nuestra ubicación y hora de acceso.","Cada vez que ingresábamos, el sistema permanecía inactivo por unos minutos.","119","Cada vez que ingresábamos, el sistema registraba nuestra ubicación y hora de acceso.","213","125.0","Cada vez que ingresábamos, el sistema registraba nuestra ubicación y hora de acceso.","1024","2","48000","-16","experiment","1","5","odd","401168.99099999864","401823.0401000037","404802.4304999999","402083.37209999445","registraba","6","False","119","401168.8909999939","402083.3413000073","400986.11120000714","NA","404910.5111999961","97531.4636999974","407044.95310000493","39199.98000000487","402073.2502000028","400986.15369999607","NA","91012.27110000036","6157.073599999421","97531.55519999564","97531.07440000167","399475.73629999533","6157.344100007322","10039.009900006931","404912.4832999951","407045.00320000807","NA","46739.06970000826","39245.056300002034","39200.04359999439","39237.601900007576","400986.1277000018","400986.14560000715","24759.80860000709","400986.1657000001","400177.986900002","NA","NA","NA","NA","8580.585600007907","400986.13710000063","401161.8346000032","NA","400986.00449999503","Sampling_Rate_Experiment","13","44973.73379999772","14","1","1","experimental","250","100","no","1920","acceso.","12","1786.0386414166296","100","1728.0","150","1000.7196450507565","565.0","515.0","972.0"
"fingió","obtuvo","1","2","¿Consiguió el individuo el visto bueno para proceder?","¿Admitió la persona haber simulado una dolencia?","93","True","93","3","3130","3130","white","yes","EyeLogicOne","0","340","0.14","psycho",".","9","760","Él afirmó que obtuvo la aprobación necesaria.","psycho","psycho","0","relative","1","YES","undefined","1","YES","undefined","1","56","56","56","0","56","0","57","0","56","56","0","0","0","0","0","56","0","0","56","56","NA","0","0","0","0","56","56","0","56","56","0","0","0","0","0","56","56","0","56","b2","YES","¿Consiguió el individuo el visto bueno para proceder?","Él afirmó que obtuvo la aprobación necesaria.","Él afirmó que obtuvo la aprobación necesaria.","Fri Apr 17 16:45:30 2026","Sampling rate","250","False","Sí","EyeLogic_Experiment_ONE.osexp","C:\Users\LabCINC\Documents\Experiments\eyelogicreading\ONE","25","É","20","0","1","411192.83139999607","False","Courier New","False","24","no","black","no","Sí","high","yes","50","50","YES","1080","6","112","YES","430","None","psycho","45","35","36","51","4","0","C:\Users\LabCINC\Documents\Experiments\eyelogicreading\ONE\subject-5.csv","psycho","7","1","Neonatal Nightingale","4.1.8","Él afirmó que ","3","2","yes","0","1","NA","2","1","1","NA","2","NA","1984.1159999923548","NA","6518.167799993535","14714.407099992968","1984.1159999923548","NA","7493.552200001432","NA","760","2","psycho","Él afirmó que obtuvo la aprobación necesaria.","Él afirmó que ","Él afirmó que obtuvo la aprobación necesaria.","Él afirmó que obtuvo la aprobación necesaria.","120","Él afirmó que fingió estar enfermo.","204","125.0","Él afirmó que obtuvo la aprobación necesaria.","1024","2","48000","-16","experiment","1","5","odd","408410.84100000444","409442.59210000746","411192.76239999454","409700.2210000064","obtuvo","3","False","120","408410.6738999981","409700.19489999686","408218.58729999803","NA","411303.0051999958","97531.4636999974","413296.06730000523","39199.98000000487","409692.7609999984","408218.62889999466","NA","91012.27110000036","6157.073599999421","97531.55519999564","97531.07440000167","407053.21189999813","6157.344100007322","10039.009900006931","411304.4971000054","413296.1231000081","NA","46739.06970000826","39245.056300002034","39200.04359999439","39237.601900007576","408218.6025999981","408218.6204000027","24759.80860000709","408218.64079999796","407764.58669999556","NA","NA","NA","NA","8580.585600007907","408218.61219999846","408404.11220000533","NA","408218.5189000011","Sampling_Rate_Experiment","14","46957.84979999007","15","1","1","experimental","250","100","no","1920","necesaria.","6","1774.901168624669","100","1728.0","150","989.6315167800299","565.0","515.0","972.0"
"instaura","consiste","1","2","","","93","True","93","3","3130","3130","white","yes","EyeLogicOne","0","536","0.14","psycho",".","9","1222","El proceso de cambio social consiste en transformaciones culturales profundas.","psycho","psycho","0","relative","1","","undefined","1","","undefined","None","57","57","57","0","57","0","58","0","57","57","0","0","0","0","0","57","0","0","57","57","NA","0","0","0","0","57","57","0","57","57","0","0","0","0","0","57","57","0","57","b2","","","El proceso de cambio social consiste en transformaciones culturales profundas.","El proceso de cambio social consiste en transformaciones culturales profundas.","Fri Apr 17 16:45:30 2026","Sampling rate","250","False","Sí","EyeLogic_Experiment_ONE.osexp","C:\Users\LabCINC\Documents\Experiments\eyelogicreading\ONE","25","E","20","0","1","417939.108999999","False","Courier New","False","24","no","black","no","Sí","high","yes","50","50","NO","1080","9","187","NO","77","None","psycho","78","65","36","52","4","0","C:\Users\LabCINC\Documents\Experiments\eyelogicreading\ONE\subject-5.csv","psycho","10","1","Neonatal Nightingale","4.1.8","El proceso de cambio social","5","2","yes","0","1","NA","2","1","1","NA","2","NA","1984.1159999923548","NA","6518.167799993535","14714.407099992968","1984.1159999923548","NA","7493.552200001432","NA","1222","2","psycho","El proceso de cambio social consiste en transformaciones culturales profundas.","El proceso de cambio social","El proceso de cambio social consiste en transformaciones culturales profundas.","El proceso de cambio social consiste en transformaciones culturales profundas.","120","El proceso de cambio social instaura nuevas dinámicas culturales.","128","125.0","El proceso de cambio social consiste en transformaciones culturales profundas.","1024","2","48000","-16","experiment","1","5","odd","414944.4332999992","415364.79130000225","417939.0407000028","415623.5561000067","consiste","5","False","120","414944.332900006","415623.53189999703","414765.14479999605","NA","411303.0051999958","97531.4636999974","418045.1788000064","39199.98000000487","415614.9177000043","414765.2001999959","NA","91012.27110000036","6157.073599999421","97531.55519999564","97531.07440000167","413303.4383000049","6157.344100007322","10039.009900006931","411304.4971000054","418045.2263000043","NA","46739.06970000826","39245.056300002034","39200.04359999439","39237.601900007576","414765.1690000057","414765.18990000477","24759.80860000709","414765.21529999445","414017.7280000062","NA","NA","NA","NA","8580.585600007907","414765.1806000067","414938.5611000034","NA","414765.0017999986","Sampling_Rate_Experiment","14","46957.84979999007","15","1","1","experimental","250","100","no","1920","profundas.","9","1853.3673615458144","100","1728.0","150","1031.5319250205032","565.0","515.0","972.0"
"ganarlo","ordenar","1","2","","","93","True","93","3","3130","3130","white","yes","EyeLogicOne","0","536","0.14","psycho",".","4","858","Una forma de conseguirlo es ganarlo trabajando duro.","psycho","psycho","0","relative","1","","undefined","1","","undefined","None","58","58","58","0","58","0","59","0","58","58","0","0","0","0","0","58","0","0","58","58","NA","0","0","0","0","58","58","0","58","58","0","0","0","0","0","58","58","0","58","b2","","","Una forma de conseguirlo es ganarlo trabajando duro.","Una forma de conseguirlo es ganarlo trabajando duro.","Fri Apr 17 16:45:30 2026","Sampling rate","250","False","Sí","EyeLogic_Experiment_ONE.osexp","C:\Users\LabCINC\Documents\Experiments\eyelogicreading\ONE","25","U","20","0","1","422348.21440000087","False","Courier New","False","24","no","black","no","Sí","low","yes","50","50","NO","1080","7","153","NO","475","None","psycho","66","52","36","53","4","0","C:\Users\LabCINC\Documents\Experiments\eyelogicreading\ONE\subject-5.csv","psycho","8","1","Neonatal Nightingale","4.1.8","Una forma de conseguirlo es ","5","2","yes","0","1","NA","2","1","1","NA","2","NA","1984.1159999923548","NA","6518.167799993535","14714.407099992968","1984.1159999923548","NA","7493.552200001432","NA","858","2","psycho","Una forma de conseguirlo es ganarlo trabajando duro.","Una forma de conseguirlo es ","Una forma de conseguirlo es ganarlo trabajando duro.","Una forma de conseguirlo es ordenar el proceso de principio a fin.","120","Una forma de conseguirlo es ganarlo trabajando duro.","207","125.0","Una forma de conseguirlo es ganarlo trabajando duro.","1024","2","48000","-16","experiment","1","5","odd","419438.52690000494","420121.0035999975","422348.11150000314","420379.21610000194","ganarlo","5","False","120","419438.4289000009","420379.19089999923","419257.28819999495","NA","411303.0051999958","97531.4636999974","422454.6193999995","39199.98000000487","420371.126500002","419257.33009999385","NA","91012.27110000036","6157.073599999421","97531.55519999564","97531.07440000167","418054.0326000046","6157.344100007322","10039.009900006931","411304.4971000054","422454.6732000017","NA","46739.06970000826","39245.056300002034","39200.04359999439","39237.601900007576","419257.30369999656","419257.32220000646","24759.80860000709","419257.3405000003","418760.90779999504","NA","NA","NA","NA","8580.585600007907","419257.3135999992","419430.77079999784","NA","419257.1919000038","Sampling_Rate_Experiment","14","46957.84979999007","15","1","1","experimental","250","100","no","1920","duro.","7","1854.7249977735714","100","1728.0","150","998.6824623447294","565.0","515.0","972.0"
"interrumpiendo","convirtiéndose","1","2","","","93","True","93","3","3130","3130","white","yes","EyeLogicOne","0","411","0.14","psycho",".","10","957","Al final, él acabó convirtiéndose en un experto reconocido.","psycho","psycho","0","relative","1","","undefined","1","","undefined","None","59","59","59","0","59","0","60","0","59","59","0","0","0","0","0","59","0","0","59","59","NA","0","0","0","0","59","59","0","59","59","0","0","0","0","0","59","59","0","59","b2","","","Al final, él acabó convirtiéndose en un experto reconocido.","Al final, él acabó convirtiéndose en un experto reconocido.","Fri Apr 17 16:45:30 2026","Sampling rate","250","False","Sí","EyeLogic_Experiment_ONE.osexp","C:\Users\LabCINC\Documents\Experiments\eyelogicreading\ONE","25","A","21","0","1","427997.76709999423","False","Courier New","False","24","no","black","no","Sí","high","yes","50","50","NO","1080","8","182","NO","93","None","psycho","59","61","36","54","4","0","C:\Users\LabCINC\Documents\Experiments\eyelogicreading\ONE\subject-5.csv","psycho","9","1","Neonatal Nightingale","4.1.8","Al final, él acabó ","4","2","yes","0","1","NA","2","1","1","NA","2","NA","1984.1159999923548","NA","6518.167799993535","14714.407099992968","1984.1159999923548","NA","7493.552200001432","NA","957","2","psycho","Al final, él acabó convirtiéndose en un experto reconocido.","Al final, él acabó ","Al final, él acabó convirtiéndose en un experto reconocido.","Al final, él acabó convirtiéndose en un experto reconocido.","121","Al final, él acabó interrumpiendo la reunión inesperadamente.","140","125.0","Al final, él acabó convirtiéndose en un experto reconocido.","1024","2","48000","-16","experiment","1","5","odd","423922.747500008","424701.7943999963","427997.6939000044","424960.49029999995","convirtiéndose","4","False","121","423922.64449999493","424960.4665000079","423739.6288000018","NA","411303.0051999958","97531.4636999974","428105.3533999948","39199.98000000487","424952.0673999941","423739.6701999969","NA","91012.27110000036","6157.073599999421","97531.55519999564","97531.07440000167","422462.7865000075","6157.344100007322","10039.009900006931","411304.4971000054","428105.41259999445","NA","46739.06970000826","39245.056300002034","39200.04359999439","39237.601900007576","423739.6448000072","423739.662100008","24759.80860000709","423739.68110000715","423171.1103999987","NA","NA","NA","NA","8580.585600007907","423739.65420000604","423913.6744999996","NA","423739.5091000071","Sampling_Rate_Experiment","14","46957.84979999007","15","1","1","experimental","250","100","no","1920","reconocido.","8","1869.0069083907006","100","1728.0","150","1017.1019038450244","565.0","515.0","972.0"
