"sacará","pasará","1","2","","","95","True","95","3","2997","2997","white","yes","EyeLogicOne","0","299","0.14","psycho",".","4","677","Mañana, él pasará temprano por tu casa.","psycho","psycho","0","relative","1","","undefined","1","","undefined","None","77","77","77","0","77","0","78","0","77","77","0","0","0","0","0","77","0","0","77","77","NA","0","0","0","0","77","77","0","77","77","0","0","0","0","0","77","77","0","77","b2","","","Mañana, él pasará temprano por tu casa.","Mañana, él pasará temprano por tu casa.","Fri Apr 17 16:45:30 2026","Sampling rate","250","False","Sí","EyeLogic_Experiment_ONE.osexp","C:\Users\LabCINC\Documents\Experiments\eyelogicreading\ONE","25","M","21","0","1","528550.3016000002","False","Courier New","False","24","no","black","no","Sí","high","yes","50","50","NO","1080","6","154","NO","183","None","psycho","39","37","36","72","4","0","C:\Users\LabCINC\Documents\Experiments\eyelogicreading\ONE\subject-5.csv","psycho","7","1","Neonatal Nightingale","4.1.8","Mañana, él ","2","2","yes","0","2","NA","2","1","2","NA","2","NA","1549.1465000086464","NA","6518.167799993535","14714.407099992968","1549.1465000086464","NA","7493.552200001432","NA","677","2","psycho","Mañana, él pasará temprano por tu casa.","Mañana, él ","Mañana, él pasará temprano por tu casa.","Mañana, él pasará temprano por tu casa.","121","Mañana, él sacará la basura temprano.","208","125.0","Mañana, él pasará temprano por tu casa.","1024","2","48000","-16","experiment","1","5","odd","526691.6866999964","518593.85970000585","528550.2192999993","526951.6747000016","pasará","2","False","121","526691.5560000052","526951.6425000038","526512.598500005","NA","514085.95700000296","97531.4636999974","528656.3878000015","39199.98000000487","526941.7571999948","526512.6468999952","NA","91012.27110000036","6157.073599999421","97531.55519999564","97531.07440000167","525389.230700006","6157.344100007322","10039.009900006931","514087.3528999946","528656.4389999985","NA","46739.06970000826","39245.056300002034","39200.04359999439","39237.601900007576","526512.6193000033","526512.6387000055","24759.80860000709","526512.6581999939","526095.8021999977","NA","NA","NA","NA","8580.585600007907","526512.6298999967","526684.7430000053","NA","526512.4493000039","Sampling_Rate_Experiment","19","59944.016399997054","20","1","1","experimental","250","100","no","1920","casa.","6","1839.7662313997585","100","1728.0","150","997.7887235105084","565.0","515.0","972.0"
"enseñaron","señalaron","1","2","","","95","True","95","3","2997","2997","white","yes","EyeLogicOne","0","353","0.14","psycho",".","6","1053","Los profesores señalaron varios errores ortográficos en tu ensayo.","psycho","psycho","0","relative","1","","undefined","1","","undefined","None","78","78","78","0","78","0","79","0","78","78","0","0","0","0","0","78","0","0","78","78","NA","0","0","0","0","78","78","0","78","78","0","0","0","0","0","78","78","0","78","b2","","","Los profesores señalaron varios errores ortográficos en tu ensayo.","Los profesores señalaron varios errores ortográficos en tu ensayo.","Fri Apr 17 16:45:30 2026","Sampling rate","250","False","Sí","EyeLogic_Experiment_ONE.osexp","C:\Users\LabCINC\Documents\Experiments\eyelogicreading\ONE","25","L","19","0","1","534331.1534999957","False","Courier New","False","24","no","black","no","Sí","high","yes","50","50","NO","1080","8","159","NO","296","None","psycho","66","80","36","73","4","0","C:\Users\LabCINC\Documents\Experiments\eyelogicreading\ONE\subject-5.csv","psycho","9","1","Neonatal Nightingale","4.1.8","Los profesores ","2","2","yes","0","2","NA","2","1","2","NA","2","NA","1549.1465000086464","NA","6518.167799993535","14714.407099992968","1549.1465000086464","NA","7493.552200001432","NA","1053","2","psycho","Los profesores señalaron varios errores ortográficos en tu ensayo.","Los profesores ","Los profesores señalaron varios errores ortográficos en tu ensayo.","Los profesores señalaron varios errores ortográficos en tu ensayo.","119","Los profesores enseñaron con dedicación y entusiasmo durante la clase magistral.","252","125.0","Los profesores señalaron varios errores ortográficos en tu ensayo.","1024","2","48000","-16","experiment","1","5","odd","530177.7151999995","531787.313000008","534331.0057000053","532046.0665999999","señalaron","2","False","119","530177.6097999973","532046.0437000002","529999.5277999988","NA","514085.95700000296","97531.4636999974","534437.0778000011","39199.98000000487","532037.485000008","529999.5663000009","NA","91012.27110000036","6157.073599999421","97531.55519999564","97531.07440000167","528664.2381999991","6157.344100007322","10039.009900006931","514087.3528999946","534437.1283000073","NA","46739.06970000826","39245.056300002034","39200.04359999439","39237.601900007576","529999.5412999997","529999.5583999989","24759.80860000709","529999.5767000073","529376.6163999971","NA","NA","NA","NA","8580.585600007907","529999.5500000077","530169.9857000058","NA","529999.4557000027","Sampling_Rate_Experiment","19","59944.016399997054","20","1","1","experimental","250","100","no","1920","ensayo.","8","1852.4206999499024","100","1728.0","150","1010.6021083174326","565.0","515.0","972.0"
"desplegados","trasladados","1","2","","","95","True","95","3","2997","2997","white","yes","EyeLogicOne","0","423","0.14","psycho",".","9","1123","Los soldados fueron desplegados rápidamente hacia la zona de conflicto.","psycho","psycho","0","relative","1","","undefined","1","","undefined","None","79","79","79","0","79","0","80","0","79","79","0","0","0","0","0","79","0","0","79","79","NA","0","0","0","0","79","79","0","79","79","0","0","0","0","0","79","79","0","79","b2","","","Los soldados fueron desplegados rápidamente hacia la zona de conflicto.","Los soldados fueron desplegados rápidamente hacia la zona de conflicto.","Fri Apr 17 16:45:30 2026","Sampling rate","250","False","Sí","EyeLogic_Experiment_ONE.osexp","C:\Users\LabCINC\Documents\Experiments\eyelogicreading\ONE","25","L","19","0","1","539537.1722999989","False","Courier New","False","24","no","black","no","Sí","low","yes","50","50","NO","1080","9","132","NO","150","None","psycho","72","71","36","74","4","0","C:\Users\LabCINC\Documents\Experiments\eyelogicreading\ONE\subject-5.csv","psycho","10","1","Neonatal Nightingale","4.1.8","Los soldados fueron ","3","2","yes","0","2","NA","2","1","2","NA","2","NA","1549.1465000086464","NA","6518.167799993535","14714.407099992968","1549.1465000086464","NA","7493.552200001432","NA","1123","2","psycho","Los soldados fueron desplegados rápidamente hacia la zona de conflicto.","Los soldados fueron ","Los soldados fueron desplegados rápidamente hacia la zona de conflicto.","Los soldados fueron trasladados de forma inesperada al campamento nuevo.","119","Los soldados fueron desplegados rápidamente hacia la zona de conflicto.","85","125.0","Los soldados fueron desplegados rápidamente hacia la zona de conflicto.","1024","2","48000","-16","experiment","1","5","odd","536021.1387000018","536749.8742000025","539537.1070999972","537008.9920000028","desplegados","3","False","119","536021.0406999977","537008.9670000016","535840.0417999947","NA","514085.95700000296","97531.4636999974","539643.3152999962","39199.98000000487","536999.9956999964","535840.091799997","NA","91012.27110000036","6157.073599999421","97531.55519999564","97531.07440000167","534447.2489000036","6157.344100007322","10039.009900006931","514087.3528999946","539643.3722000074","NA","46739.06970000826","39245.056300002034","39200.04359999439","39237.601900007576","535840.0643000059","535840.0836000073","24759.80860000709","535840.102400005","535156.5478999983","NA","NA","NA","NA","8580.585600007907","535840.0750000001","536012.4402000074","NA","535839.8900000029","Sampling_Rate_Experiment","19","59944.016399997054","20","1","1","experimental","250","100","no","1920","conflicto.","9","1858.4011453665066","100","1728.0","150","1006.6099208552531","565.0","515.0","972.0"
"crían","viven","1","2","¿Hay muchas personas que viven en situación de pobreza extrema en esa zona? ","¿En esa zona, crían cerdos y vacas?","95","True","95","3","2934","2934","white","yes","EyeLogicOne","0","550","0.14","psycho",".","6","844","En esa zona, muchas personas crían cabras y ovejas.","psycho","psycho","0","relative","1","YES","undefined","1","NO","undefined","2","80","80","80","0","80","0","81","0","80","80","0","0","0","0","0","80","0","0","80","80","NA","0","0","0","0","80","80","0","80","80","0","0","0","0","0","80","80","0","80","b2","NO","¿En esa zona, crían cerdos y vacas?","En esa zona, muchas personas crían cabras y ovejas.","En esa zona, muchas personas crían cabras y ovejas.","Fri Apr 17 16:45:30 2026","Sampling rate","250","False","Sí","EyeLogic_Experiment_ONE.osexp","C:\Users\LabCINC\Documents\Experiments\eyelogicreading\ONE","25","E","20","0","1","543349.7031000006","False","Courier New","False","24","no","black","no","Sí","low","yes","50","50","YES","1080","8","121","YES","240","None","psycho","67","51","36","75","4","0","C:\Users\LabCINC\Documents\Experiments\eyelogicreading\ONE\subject-5.csv","psycho","9","1","Neonatal Nightingale","4.1.8","En esa zona, muchas personas ","5","2","yes","0","2","NA","2","1","2","NA","2","NA","1672.995600005379","NA","6518.167799993535","14714.407099992968","1672.995600005379","NA","7493.552200001432","NA","844","2","psycho","En esa zona, muchas personas crían cabras y ovejas.","En esa zona, muchas personas ","En esa zona, muchas personas crían cabras y ovejas.","En esa zona, muchas personas viven en situación de pobreza extrema.","120","En esa zona, muchas personas crían cabras y ovejas.","275","125.0","En esa zona, muchas personas crían cabras y ovejas.","1024","2","48000","-16","experiment","1","5","odd","541032.4546000047","536749.8742000025","543349.6393999958","541290.5758999987","crían","5","False","120","541032.3541999969","541290.5524999951","540853.2175","NA","543457.0869000017","97531.4636999974","545138.0471000011","39199.98000000487","541282.5206999987","540853.2577000005","NA","91012.27110000036","6157.073599999421","97531.55519999564","97531.07440000167","539650.6484999991","6157.344100007322","10039.009900006931","543458.4792999958","545138.0948000005","NA","46739.06970000826","39245.056300002034","39200.04359999439","39237.601900007576","540853.2306999987","540853.2491000078","24759.80860000709","540853.2685999962","540356.435099995","NA","NA","NA","NA","8580.585600007907","540853.240299999","541024.2660999938","NA","540853.1497000076","Sampling_Rate_Experiment","20","61617.01200000243","21","1","1","experimental","250","100","no","1920","ovejas.","8","1858.1489339481616","100","1728.0","150","999.565796041523","565.0","515.0","972.0"
"minoritario","demográfico","1","2","","","95","True","95","3","2934","2934","white","yes","EyeLogicOne","0","508","0.14","psycho",".","7","1320","En nuestro país, el grupo minoritario disfruta de los mismos derechos que la mayoría.","psycho","psycho","0","relative","1","","undefined","1","","undefined","None","81","81","81","0","81","0","82","0","81","81","0","0","0","0","0","81","0","0","81","81","NA","0","0","0","0","81","81","0","81","81","0","0","0","0","0","81","81","0","81","b2","","","En nuestro país, el grupo minoritario disfruta de los mismos derechos que la mayoría.","En nuestro país, el grupo minoritario disfruta de los mismos derechos que la mayoría.","Fri Apr 17 16:45:30 2026","Sampling rate","250","False","Sí","EyeLogic_Experiment_ONE.osexp","C:\Users\LabCINC\Documents\Experiments\eyelogicreading\ONE","25","E","20","0","1","551071.7946000077","False","Courier New","False","24","no","black","no","Sí","low","yes","50","50","NO","1080","13","195","NO","384","None","psycho","91","85","36","76","4","0","C:\Users\LabCINC\Documents\Experiments\eyelogicreading\ONE\subject-5.csv","psycho","14","1","Neonatal Nightingale","4.1.8","En nuestro país, el grupo","5","2","yes","0","2","NA","2","1","2","NA","2","NA","1672.995600005379","NA","6518.167799993535","14714.407099992968","1672.995600005379","NA","7493.552200001432","NA","1320","2","psycho","En nuestro país, el grupo minoritario disfruta de los mismos derechos que la mayoría.","En nuestro país, el grupo","En nuestro país, el grupo minoritario disfruta de los mismos derechos que la mayoría.","En nuestro país, el grupo demográfico más afectado por la crisis económica son los jóvenes.","120","En nuestro país, el grupo minoritario disfruta de los mismos derechos que la mayoría.","15","125.0","En nuestro país, el grupo minoritario disfruta de los mismos derechos que la mayoría.","1024","2","48000","-16","experiment","1","5","odd","546838.8704999961","548023.4190000047","551071.7188999988","548281.3809000072","minoritario","5","False","120","546838.759899998","548281.3547999976","546658.6366999982","NA","543457.0869000017","97531.4636999974","551178.5876000067","39199.98000000487","548273.5743999947","546658.7012999953","NA","91012.27110000036","6157.073599999421","97531.55519999564","97531.07440000167","545149.0238999977","6157.344100007322","10039.009900006931","543458.4792999958","551178.6528999946","NA","46739.06970000826","39245.056300002034","39200.04359999439","39237.601900007576","546658.6706999951","546658.6915999942","24759.80860000709","546658.712599994","545852.3259000067","NA","NA","NA","NA","8580.585600007907","546658.6820999946","546831.4116999973","NA","546658.503300001","Sampling_Rate_Experiment","20","61617.01200000243","21","1","1","experimental","250","100","no","1920","mayoría.","13","1857.2948494728162","100","1728.0","150","1019.9283314430345","565.0","515.0","972.0"
"profesaba","aseguraba","1","2","","","95","True","95","3","2934","2934","white","yes","EyeLogicOne","0","326","0.14","psycho",".","9","1474","El sacerdote aseguraba con firmeza que la fe es la respuesta a nuestras preguntas más profundas.","psycho","psycho","0","relative","1","","undefined","1","","undefined","None","82","82","82","0","82","0","83","0","82","82","0","0","0","0","0","82","0","0","82","82","NA","0","0","0","0","82","82","0","82","82","0","0","0","0","0","82","82","0","82","b2","","","El sacerdote aseguraba con firmeza que la fe es la respuesta a nuestras preguntas más profundas.","El sacerdote aseguraba con firmeza que la fe es la respuesta a nuestras preguntas más profundas.","Fri Apr 17 16:45:30 2026","Sampling rate","250","False","Sí","EyeLogic_Experiment_ONE.osexp","C:\Users\LabCINC\Documents\Experiments\eyelogicreading\ONE","25","E","20","0","1","557716.099199999","False","Courier New","False","24","no","black","no","Sí","high","yes","50","50","NO","1080","15","178","NO","51","None","psycho","96","64","36","77","4","0","C:\Users\LabCINC\Documents\Experiments\eyelogicreading\ONE\subject-5.csv","psycho","16","1","Neonatal Nightingale","4.1.8","El sacerdote ","2","2","yes","0","2","NA","2","1","2","NA","2","NA","1672.995600005379","NA","6518.167799993535","14714.407099992968","1672.995600005379","NA","7493.552200001432","NA","1474","2","psycho","El sacerdote aseguraba con firmeza que la fe es la respuesta a nuestras preguntas más profundas.","El sacerdote ","El sacerdote aseguraba con firmeza que la fe es la respuesta a nuestras preguntas más profundas.","El sacerdote aseguraba con firmeza que la fe es la respuesta a nuestras preguntas más profundas.","120","El sacerdote profesaba una fe inquebrantable en su congregación.","104","125.0","El sacerdote aseguraba con firmeza que la fe es la respuesta a nuestras preguntas más profundas.","1024","2","48000","-16","experiment","1","5","odd","552970.7806999941","554192.9743000073","557716.0092999984","554450.7138000045","aseguraba","2","False","120","552970.6838999991","554450.6676000019","552792.2252999997","NA","543457.0869000017","97531.4636999974","557822.270100005","39199.98000000487","554443.1052","552792.2771000012","NA","91012.27110000036","6157.073599999421","97531.55519999564","97531.07440000167","551186.6778999974","6157.344100007322","10039.009900006931","543458.4792999958","557822.3266999994","NA","46739.06970000826","39245.056300002034","39200.04359999439","39237.601900007576","552792.2487000033","552792.2685999947","24759.80860000709","552792.2891000053","551901.8855000031","NA","NA","NA","NA","8580.585600007907","552792.2594999982","552963.6666000006","NA","552792.0678999944","Sampling_Rate_Experiment","20","61617.01200000243","21","1","1","experimental","250","100","no","1920","profundas.","15","1744.6601938621297","100","1728.0","150","995.5774257928115","565.0","515.0","972.0"
"balanceo","gobierno","1","2","","","95","True","95","3","2934","2934","white","yes","EyeLogicOne","0","313","0.14","psycho",".","11","1013","A veces, el gobierno toma decisiones equivocadas e impopulares.","psycho","psycho","0","relative","1","","undefined","1","","undefined","None","83","83","83","0","83","0","84","0","83","83","0","0","0","0","0","83","0","0","83","83","NA","0","0","0","0","83","83","0","83","83","0","0","0","0","0","83","83","0","83","b2","","","A veces, el gobierno toma decisiones equivocadas e impopulares.","A veces, el gobierno toma decisiones equivocadas e impopulares.","Fri Apr 17 16:45:30 2026","Sampling rate","250","False","Sí","EyeLogic_Experiment_ONE.osexp","C:\Users\LabCINC\Documents\Experiments\eyelogicreading\ONE","25","A","21","0","1","561508.4041999944","False","Courier New","False","24","no","black","no","Sí","high","yes","50","50","NO","1080","8","146","NO","155","None","psycho","63","55","36","78","4","0","C:\Users\LabCINC\Documents\Experiments\eyelogicreading\ONE\subject-5.csv","psycho","9","1","Neonatal Nightingale","4.1.8","A veces, el ","3","2","yes","0","2","NA","2","1","2","NA","2","NA","1672.995600005379","NA","6518.167799993535","14714.407099992968","1672.995600005379","NA","7493.552200001432","NA","1013","2","psycho","A veces, el gobierno toma decisiones equivocadas e impopulares.","A veces, el ","A veces, el gobierno toma decisiones equivocadas e impopulares.","A veces, el gobierno toma decisiones equivocadas e impopulares.","121","A veces, el balanceo puede ser relajante y terapéutico.","320","125.0","A veces, el gobierno toma decisiones equivocadas e impopulares.","1024","2","48000","-16","experiment","1","5","odd","559335.4504000017","559397.9753000021","561508.3044000057","559657.0505999989","gobierno","3","False","121","559335.2707000013","559657.0241000009","559149.8324999993","NA","543457.0869000017","97531.4636999974","561614.9215000041","39199.98000000487","559648.1432","559149.8742999975","NA","91012.27110000036","6157.073599999421","97531.55519999564","97531.07440000167","557832.868700003","6157.344100007322","10039.009900006931","543458.4792999958","561614.9762999994","NA","46739.06970000826","39245.056300002034","39200.04359999439","39237.601900007576","559149.8482000025","559149.8661000078","24759.80860000709","559149.8861","558549.1913000005","NA","NA","NA","NA","8580.585600007907","559149.8578000028","559327.8339999961","NA","559149.6980999946","Sampling_Rate_Experiment","20","61617.01200000243","21","1","1","experimental","250","100","no","1920","impopulares.","8","1845.583643119705","100","1728.0","150","975.7200462169324","565.0","515.0","972.0"
"vivaz","feroz","1","2","¿El comportamiento del animal era agresivo?","¿El animal se movía de manera triste y lenta?","95","True","95","3","2876","2876","white","yes","EyeLogicOne","0","550","0.14","psycho",".","6","746","El animal se movía de manera vivaz y alegre.","psycho","psycho","0","relative","1","YES","undefined","1","NO","undefined","2","84","84","84","0","84","0","85","0","84","84","0","0","0","0","0","84","0","0","84","84","NA","0","0","0","0","84","84","0","84","84","0","0","0","0","0","84","84","0","84","b2","NO","¿El animal se movía de manera triste y lenta?","El animal se movía de manera vivaz y alegre.","El animal se movía de manera vivaz y alegre.","Fri Apr 17 16:45:30 2026","Sampling rate","250","False","Sí","EyeLogic_Experiment_ONE.osexp","C:\Users\LabCINC\Documents\Experiments\eyelogicreading\ONE","25","E","20","0","1","565828.4639000049","False","Courier New","False","24","no","black","no","Sí","low","yes","50","50","YES","1080","8","127","YES","103","None","psycho","49","44","36","79","4","0","C:\Users\LabCINC\Documents\Experiments\eyelogicreading\ONE\subject-5.csv","psycho","9","1","Neonatal Nightingale","4.1.8","El animal se movía de manera ","6","2","yes","0","2","NA","2","1","2","NA","2","NA","1666.1647000000812","NA","6518.167799993535","14714.407099992968","1666.1647000000812","NA","7493.552200001432","NA","746","2","psycho","El animal se movía de manera vivaz y alegre.","El animal se movía de manera ","El animal se movía de manera vivaz y alegre.","El animal se movía de manera feroz y amenazadora.","120","El animal se movía de manera vivaz y alegre.","35","125.0","El animal se movía de manera vivaz y alegre.","1024","2","48000","-16","experiment","1","5","odd","562946.9562000013","563002.176199996","565828.382000007","563260.4699999938","vivaz","6","False","120","562946.8573000049","563260.446100001","562766.6692000057","NA","565935.8782000054","97531.4636999974","567609.7600000066","39199.98000000487","563252.3351999989","562766.7060999956","NA","91012.27110000036","6157.073599999421","97531.55519999564","97531.07440000167","561622.4738000019","6157.344100007322","10039.009900006931","565937.4341000075","567609.8135000066","NA","46739.06970000826","39245.056300002034","39200.04359999439","39237.601900007576","562766.6813999967","562766.697900006","24759.80860000709","562766.7167000036","562331.5229","NA","NA","NA","NA","8580.585600007907","562766.6901000048","562938.0851000024","NA","562766.6085999954","Sampling_Rate_Experiment","21","63283.176700002514","22","1","1","experimental","250","100","no","1920","alegre.","8","1849.8028712684818","100","1728.0","150","987.4789667519233","565.0","515.0","972.0"
"anunciadas","destacadas","1","2","¿El plan de seguridad pasó desapercibido? ","¿Se anunciaron los resultados de las elecciones locales? ","91","True","91","3","2832","2832","white","yes","EyeLogicOne","0","466","0.14","psycho",".","9","1432","Entre las noticias más destacadas de hoy se encuentra el anuncio del nuevo plan de seguridad.","psycho","psycho","0","relative","0","YES","undefined","0","NO","undefined","1","85","85","85","0","85","0","86","0","85","85","0","0","0","0","0","85","0","0","85","85","NA","0","0","0","0","85","85","0","85","85","0","0","0","0","0","85","85","0","85","b2","YES","¿El plan de seguridad pasó desapercibido? ","Entre las noticias más destacadas de hoy se encuentra el anuncio del nuevo plan de seguridad.","Entre las noticias más destacadas de hoy se encuentra el anuncio del nuevo plan de seguridad.","Fri Apr 17 16:45:30 2026","Sampling rate","250","False","Sí","EyeLogic_Experiment_ONE.osexp","C:\Users\LabCINC\Documents\Experiments\eyelogicreading\ONE","25","E","20","0","1","573708.4180999955","False","Courier New","False","24","no","black","no","Sí","high","yes","50","50","YES","1080","15","126","YES","172","None","psycho","93","93","36","80","4","0","C:\Users\LabCINC\Documents\Experiments\eyelogicreading\ONE\subject-5.csv","psycho","16","1","Neonatal Nightingale","4.1.8","Entre las noticias más ","4","2","yes","0","2","NA","2","1","2","NA","2","NA","1854.4705999956932","NA","6518.167799993535","14714.407099992968","1854.4705999956932","NA","7493.552200001432","NA","1432","2","psycho","Entre las noticias más destacadas de hoy se encuentra el anuncio del nuevo plan de seguridad.","Entre las noticias más ","Entre las noticias más destacadas de hoy se encuentra el anuncio del nuevo plan de seguridad.","Entre las noticias más destacadas de hoy se encuentra el anuncio del nuevo plan de seguridad.","120","Entre las noticias más anunciadas se encuentra el resultado de las elecciones presidenciales.","20","125.0","Entre las noticias más destacadas de hoy se encuentra el anuncio del nuevo plan de seguridad.","1024","2","48000","-16","experiment","1","5","odd","569393.7838999991","570633.1747000077","573708.3142000047","570890.9075999982","destacadas","4","False","120","569393.6948000046","570890.8785999956","569207.0600000006","NA","573815.823900004","97531.4636999974","575677.4449999939","39199.98000000487","570883.3257000078","569207.1105000068","NA","91012.27110000036","6157.073599999421","97531.55519999564","97531.07440000167","567617.1917000029","6157.344100007322","10039.009900006931","573816.9959000079","575677.4961000046","NA","46739.06970000826","39245.056300002034","39200.04359999439","39237.601900007576","569207.0823999966","569207.1023000026","24759.80860000709","569207.1228999994","568330.3314999939","NA","NA","NA","NA","8580.585600007907","569207.0934000076","569387.7347999951","NA","569206.9630000042","Sampling_Rate_Experiment","21","65137.64729999821","23","1","1","experimental","250","100","no","1920","seguridad.","15","1862.1518025725209","100","1728.0","150","1003.6345218440403","565.0","515.0","972.0"
