"conservaban","pertenecían","1","2","¿Eran los objetos expuestos representativos de una civilización antigua?","¿Carecían de importancia histórica los elementos del museo?","87","True","87","3","4035","4035","white","yes","EyeLogicOne","0","732","0.14","psycho",".","9","1222","En el museo se encontraban las piezas que conservaban un gran valor histórico.","psycho","psycho","0","relative","1","YES","undefined","1","NO","undefined","2","25","25","25","0","25","0","26","0","25","25","0","0","0","0","0","25","0","0","25","25","NA","0","0","0","0","25","25","0","25","25","0","0","0","0","0","25","25","0","25","b2","NO","¿Carecían de importancia histórica los elementos del museo?","En el museo se encontraban las piezas que conservaban un gran valor histórico.","En el museo se encontraban las piezas que conservaban un gran valor histórico.","Fri Apr 17 16:45:30 2026","Sampling rate","250","False","Sí","EyeLogic_Experiment_ONE.osexp","C:\Users\LabCINC\Documents\Experiments\eyelogicreading\ONE","25","E","20","0","1","233884.56750000478","False","Courier New","False","24","no","black","no","Sí","low","yes","50","50","YES","1080","12","115","YES","427","None","psycho","72","78","36","20","4","0","C:\Users\LabCINC\Documents\Experiments\eyelogicreading\ONE\subject-5.csv","psycho","13","1","Neonatal Nightingale","4.1.8","En el museo se encontraban las piezas que ","8","2","yes","0","2","NA","2","1","2","NA","2","NA","4028.1778999924427","NA","6518.167799993535","14714.407099992968","4028.1778999924427","NA","7493.552200001432","NA","1222","2","psycho","En el museo se encontraban las piezas que conservaban un gran valor histórico.","En el museo se encontraban las piezas que ","En el museo se encontraban las piezas que conservaban un gran valor histórico.","En el museo se encontraban las piezas que pertenecían a la cultura Maya.","120","En el museo se encontraban las piezas que conservaban un gran valor histórico.","215","125.0","En el museo se encontraban las piezas que conservaban un gran valor histórico.","1024","2","48000","-16","experiment","1","5","odd","230789.68210000312","221410.7570000051","233884.46990000375","231048.9768999978","conservaban","8","False","120","230789.58080000302","231048.95349999424","230573.35720000265","NA","233991.96640000446","97531.4636999974","238028.1047000026","39199.98000000487","231039.7590000066","230573.39849999698","NA","91012.27110000036","6157.073599999421","97531.55519999564","97531.07440000167","229111.80319999403","6157.344100007322","10039.009900006931","233993.3902000048","238028.15579999879","NA","46739.06970000826","39245.056300002034","39200.04359999439","39237.601900007576","230573.3712000074","230573.39000000502","24759.80860000709","230573.40979999572","229835.20869999484","NA","NA","NA","NA","8580.585600007907","230573.38089999394","230782.05199999502","NA","230573.26970000577","Sampling_Rate_Experiment","7","32280.915299983462","8","1","1","experimental","250","100","no","1920","histórico.","12","1859.4491845320372","100","1728.0","150","993.8324364521086","565.0","515.0","972.0"
"traumatismo","descontento","1","2","","","87","True","87","3","4035","4035","white","yes","EyeLogicOne","0","452","0.14","psycho",".","8","1068","El incidente causó un descontento generalizado y una gran protesta.","psycho","psycho","0","relative","1","","undefined","1","","undefined","None","26","26","26","0","26","0","27","0","26","26","0","0","0","0","0","26","0","0","26","26","NA","0","0","0","0","26","26","0","26","26","0","0","0","0","0","26","26","0","26","b2","","","El incidente causó un descontento generalizado y una gran protesta.","El incidente causó un descontento generalizado y una gran protesta.","Fri Apr 17 16:45:30 2026","Sampling rate","250","False","Sí","EyeLogic_Experiment_ONE.osexp","C:\Users\LabCINC\Documents\Experiments\eyelogicreading\ONE","25","E","20","0","1","243764.82949999627","False","Courier New","False","24","no","black","no","Sí","high","yes","50","50","NO","1080","9","194","NO","290","None","psycho","67","48","36","21","4","0","C:\Users\LabCINC\Documents\Experiments\eyelogicreading\ONE\subject-5.csv","psycho","10","1","Neonatal Nightingale","4.1.8","El incidente causó un","4","2","yes","0","2","NA","2","1","2","NA","2","NA","4028.1778999924427","NA","6518.167799993535","14714.407099992968","4028.1778999924427","NA","7493.552200001432","NA","1068","2","psycho","El incidente causó un descontento generalizado y una gran protesta.","El incidente causó un","El incidente causó un descontento generalizado y una gran protesta.","El incidente causó un descontento generalizado y una gran protesta.","120","El incidente causó un traumatismo craneal grave.","364","125.0","El incidente causó un descontento generalizado y una gran protesta.","1024","2","48000","-16","experiment","1","5","odd","239599.661500004","240750.73580000026","243764.6037999948","241009.09970000794","descontento","4","False","120","239599.55230000196","241009.06840000243","239412.6130000077","NA","233991.96640000446","97531.4636999974","243871.00830000418","39199.98000000487","241000.8622000023","239412.66080000787","NA","91012.27110000036","6157.073599999421","97531.55519999564","97531.07440000167","238037.6133999962","6157.344100007322","10039.009900006931","233993.3902000048","243871.08559999615","NA","46739.06970000826","39245.056300002034","39200.04359999439","39237.601900007576","239412.63340000296","239412.6527000044","24759.80860000709","239412.67360000347","238755.1853000041","NA","NA","NA","NA","8580.585600007907","239412.64399999636","239593.78429999924","NA","239412.48549999727","Sampling_Rate_Experiment","7","32280.915299983462","8","1","1","experimental","250","100","no","1920","protesta.","9","1844.8386668267303","100","1728.0","150","1013.7399215834811","565.0","515.0","972.0"
"incumplimientos","descubrimientos","1","2","¿La frase habla de la importancia de la planificación?","¿Se cumplió todo?","88","True","88","3","3801","3801","white","yes","EyeLogicOne","0","579","0.14","psycho",".","8","1223","Algunos de los más importantes incumplimientos han afectado al medio ambiente.","psycho","psycho","0","relative","1","NO","undefined","1","NO","undefined","2","27","27","27","0","27","0","28","0","27","27","0","0","0","0","0","27","0","0","27","27","NA","0","0","0","0","27","27","0","27","27","0","0","0","0","0","27","27","0","27","b2","NO","¿Se cumplió todo?","Algunos de los más importantes incumplimientos han afectado al medio ambiente.","Algunos de los más importantes incumplimientos han afectado al medio ambiente.","Fri Apr 17 16:45:30 2026","Sampling rate","250","False","Sí","EyeLogic_Experiment_ONE.osexp","C:\Users\LabCINC\Documents\Experiments\eyelogicreading\ONE","25","A","21","0","1","248914.2470999941","False","Courier New","False","24","no","black","no","Sí","low","yes","50","50","YES","1080","10","125","YES","81","None","psycho","91","78","36","22","4","0","C:\Users\LabCINC\Documents\Experiments\eyelogicreading\ONE\subject-5.csv","psycho","11","1","Neonatal Nightingale","4.1.8","Algunos de los más importantes ","5","2","yes","0","2","NA","2","1","2","NA","2","NA","1935.4023000050802","NA","6518.167799993535","14714.407099992968","1935.4023000050802","NA","7493.552200001432","NA","1223","2","psycho","Algunos de los más importantes incumplimientos han afectado al medio ambiente.","Algunos de los más importantes ","Algunos de los más importantes incumplimientos han afectado al medio ambiente.","Algunos de los más importantes descubrimientos científicos fueron realizados por accidente.","121","Algunos de los más importantes incumplimientos han afectado al medio ambiente.","299","125.0","Algunos de los más importantes incumplimientos han afectado al medio ambiente.","1024","2","48000","-16","experiment","1","5","odd","245528.75199999835","240750.73580000026","248914.15690000576","245786.76400000404","incumplimientos","5","False","121","245528.6527999997","245786.74290000345","245347.84879999643","NA","249021.62410000165","97531.4636999974","250964.50499999628","39199.98000000487","245778.81889999844","245347.88729999855","NA","91012.27110000036","6157.073599999421","97531.55519999564","97531.07440000167","243878.5984999995","6157.344100007322","10039.009900006931","249023.06469999894","250964.56670000043","NA","46739.06970000826","39245.056300002034","39200.04359999439","39237.601900007576","245347.86140000506","245347.87890000734","24759.80860000709","245347.89770000498","244598.17149999435","NA","NA","NA","NA","8580.585600007907","245347.8705000016","245517.8761999996","NA","245347.78090000327","Sampling_Rate_Experiment","8","34216.31759998854","9","1","1","experimental","250","100","no","1920","ambiente.","10","1869.4934895885708","100","1728.0","150","1007.5670231468772","565.0","515.0","972.0"
"procesa","comenta","1","2","","","88","True","88","3","3801","3801","white","yes","EyeLogicOne","0","760","0.14","psycho",".","7","1306","En primer lugar, se debe considerar cómo se comenta la situación actual del mercado.","psycho","psycho","0","relative","1","","undefined","1","","undefined","None","28","28","28","0","28","0","29","0","28","28","0","0","0","0","0","28","0","0","28","28","NA","0","0","0","0","28","28","0","28","28","0","0","0","0","0","28","28","0","28","b2","","","En primer lugar, se debe considerar cómo se comenta la situación actual del mercado.","En primer lugar, se debe considerar cómo se comenta la situación actual del mercado.","Fri Apr 17 16:45:30 2026","Sampling rate","250","False","Sí","EyeLogic_Experiment_ONE.osexp","C:\Users\LabCINC\Documents\Experiments\eyelogicreading\ONE","25","E","20","0","1","256387.74429999467","False","Courier New","False","24","no","black","no","Sí","high","yes","50","50","NO","1080","13","136","NO","158","None","psycho","84","79","36","23","4","0","C:\Users\LabCINC\Documents\Experiments\eyelogicreading\ONE\subject-5.csv","psycho","14","1","Neonatal Nightingale","4.1.8","En primer lugar, se debe considerar cómo se ","8","2","yes","0","2","NA","2","1","2","NA","2","NA","1935.4023000050802","NA","6518.167799993535","14714.407099992968","1935.4023000050802","NA","7493.552200001432","NA","1306","2","psycho","En primer lugar, se debe considerar cómo se comenta la situación actual del mercado.","En primer lugar, se debe considerar cómo se ","En primer lugar, se debe considerar cómo se comenta la situación actual del mercado.","En primer lugar, se debe considerar cómo se comenta la situación actual del mercado.","120","En primer lugar, se debe considerar cómo se procesa la información recolectada.","112","125.0","En primer lugar, se debe considerar cómo se comenta la situación actual del mercado.","1024","2","48000","-16","experiment","1","5","odd","252652.2885000013","252976.40149999643","256387.64889999584","253234.02639999404","comenta","8","False","120","252652.1900999942","253234.00050000055","252473.9002999995","NA","249021.62410000165","97531.4636999974","256494.33030000364","39199.98000000487","253226.56900000584","252473.9527000056","NA","91012.27110000036","6157.073599999421","97531.55519999564","97531.07440000167","250972.9762000061","6157.344100007322","10039.009900006931","249023.06469999894","256494.38309999823","NA","46739.06970000826","39245.056300002034","39200.04359999439","39237.601900007576","252473.92299999774","252473.94310000527","24759.80860000709","252473.96640000807","251688.42730000324","NA","NA","NA","NA","8580.585600007907","252473.93370000646","252646.213","NA","252473.75730000203","Sampling_Rate_Experiment","8","34216.31759998854","9","1","1","experimental","250","100","no","1920","mercado.","13","1844.8908160270012","100","1728.0","150","1014.8417110093253","565.0","515.0","972.0"
"atreviéndose","construyendo","1","2","","","88","True","88","3","3801","3801","white","yes","EyeLogicOne","0","437","0.14","psycho",".","6","927","Sin miedo, él siguió atreviéndose a perseguir sus sueños.","psycho","psycho","0","relative","1","","undefined","1","","undefined","None","29","29","29","0","29","0","30","0","29","29","0","0","0","0","0","29","0","0","29","29","NA","0","0","0","0","29","29","0","29","29","0","0","0","0","0","29","29","0","29","b2","","","Sin miedo, él siguió atreviéndose a perseguir sus sueños.","Sin miedo, él siguió atreviéndose a perseguir sus sueños.","Fri Apr 17 16:45:30 2026","Sampling rate","250","False","Sí","EyeLogic_Experiment_ONE.osexp","C:\Users\LabCINC\Documents\Experiments\eyelogicreading\ONE","25","S","19","0","1","262060.23260000802","False","Courier New","False","24","no","black","no","Sí","low","yes","50","50","NO","1080","8","138","NO","161","None","psycho","56","57","36","24","4","0","C:\Users\LabCINC\Documents\Experiments\eyelogicreading\ONE\subject-5.csv","psycho","9","1","Neonatal Nightingale","4.1.8","Sin miedo, él siguió ","4","2","yes","0","2","NA","2","1","2","NA","2","NA","1935.4023000050802","NA","6518.167799993535","14714.407099992968","1935.4023000050802","NA","7493.552200001432","NA","927","2","psycho","Sin miedo, él siguió atreviéndose a perseguir sus sueños.","Sin miedo, él siguió ","Sin miedo, él siguió atreviéndose a perseguir sus sueños.","Sin miedo, él siguió construyendo su sueño día tras día.","119","Sin miedo, él siguió atreviéndose a perseguir sus sueños.","131","125.0","Sin miedo, él siguió atreviéndose a perseguir sus sueños.","1024","2","48000","-16","experiment","1","5","odd","257950.62420000613","259425.1515000069","262060.15230000776","259683.675399996","atreviéndose","4","False","119","257950.52100000612","259683.6375999992","257772.14159999858","NA","249021.62410000165","97531.4636999974","262166.75889999897","39199.98000000487","259675.27599999448","257772.18379999977","NA","91012.27110000036","6157.073599999421","97531.55519999564","97531.07440000167","256502.81990000803","6157.344100007322","10039.009900006931","249023.06469999894","262166.81369999424","NA","46739.06970000826","39245.056300002034","39200.04359999439","39237.601900007576","257772.157600004","257772.17549999477","24759.80860000709","257772.19489999698","257222.42180000467","NA","NA","NA","NA","8580.585600007907","257772.1670000028","257943.54340000427","NA","257772.01169999898","Sampling_Rate_Experiment","8","34216.31759998854","9","1","1","experimental","250","100","no","1920","sueños.","8","1869.7565059832925","100","1728.0","150","1011.7492961482318","565.0","515.0","972.0"
"óvulo","disco","1","2","","","88","True","88","3","3801","3801","white","yes","EyeLogicOne","0","1054","0.14","psycho",".","11","1376","Hoy en día, la tecnología nos permite crear copias exactas de un óvulo en el laboratorio.","psycho","psycho","0","relative","1","","undefined","1","","undefined","None","30","30","30","0","30","0","31","0","30","30","0","0","0","0","0","30","0","0","30","30","NA","0","0","0","0","30","30","0","30","30","0","0","0","0","0","30","30","0","30","b2","","","Hoy en día, la tecnología nos permite crear copias exactas de un óvulo en el laboratorio.","Hoy en día, la tecnología nos permite crear copias exactas de un óvulo en el laboratorio.","Fri Apr 17 16:45:30 2026","Sampling rate","250","False","Sí","EyeLogic_Experiment_ONE.osexp","C:\Users\LabCINC\Documents\Experiments\eyelogicreading\ONE","25","H","20","0","1","267336.52539999457","False","Courier New","False","24","no","black","no","Sí","low","yes","50","50","NO","1080","15","164","NO","50","None","psycho","94","89","36","25","4","0","C:\Users\LabCINC\Documents\Experiments\eyelogicreading\ONE\subject-5.csv","psycho","16","1","Neonatal Nightingale","4.1.8","Hoy en día, la tecnología nos permite crear copias exactas de un ","12","2","yes","0","2","NA","2","1","2","NA","2","NA","1935.4023000050802","NA","6518.167799993535","14714.407099992968","1935.4023000050802","NA","7493.552200001432","NA","1376","2","psycho","Hoy en día, la tecnología nos permite crear copias exactas de un óvulo en el laboratorio.","Hoy en día, la tecnología nos permite crear copias exactas de un ","Hoy en día, la tecnología nos permite crear copias exactas de un óvulo en el laboratorio.","Hoy en día, la tecnología nos permite crear copias exactas de un disco en cuestión de minutos.","120","Hoy en día, la tecnología nos permite crear copias exactas de un óvulo en el laboratorio.","291","125.0","Hoy en día, la tecnología nos permite crear copias exactas de un óvulo en el laboratorio.","1024","2","48000","-16","experiment","1","5","odd","263907.12370000256","259425.1515000069","267336.45070000784","264165.2157000062","óvulo","12","False","120","263907.0112000045","264165.1913999958","263726.10899999563","NA","249021.62410000165","97531.4636999974","267442.78729999496","39199.98000000487","264157.186299999","263726.1494999984","NA","91012.27110000036","6157.073599999421","97531.55519999564","97531.07440000167","262174.898199999","6157.344100007322","10039.009900006931","249023.06469999894","267442.84479999624","NA","46739.06970000826","39245.056300002034","39200.04359999439","39237.601900007576","263726.1225999973","263726.1412999942","24759.80860000709","263726.1606999964","262892.3761000042","NA","NA","NA","NA","8580.585600007907","263726.1326000007","263899.5114999998","NA","263726.0389000003","Sampling_Rate_Experiment","8","34216.31759998854","9","1","1","experimental","250","100","no","1920","laboratorio.","15","1859.4394298077204","100","1728.0","150","1015.1187899538911","565.0","515.0","972.0"
"absolutista","profesional","1","2","","","88","True","88","3","3801","3801","white","yes","EyeLogicOne","0","467","0.14","psycho",".","5","901","Algunos piensan que el absolutista era un tirano cruel.","psycho","psycho","0","relative","1","","undefined","1","","undefined","None","31","31","31","0","31","0","32","0","31","31","0","0","0","0","0","31","0","0","31","31","NA","0","0","0","0","31","31","0","31","31","0","0","0","0","0","31","31","0","31","b2","","","Algunos piensan que el absolutista era un tirano cruel.","Algunos piensan que el absolutista era un tirano cruel.","Fri Apr 17 16:45:30 2026","Sampling rate","250","False","Sí","EyeLogic_Experiment_ONE.osexp","C:\Users\LabCINC\Documents\Experiments\eyelogicreading\ONE","25","A","21","0","1","273333.3033999952","False","Courier New","False","24","no","black","no","Sí","low","yes","50","50","NO","1080","8","174","NO","402","None","psycho","79","55","36","26","4","0","C:\Users\LabCINC\Documents\Experiments\eyelogicreading\ONE\subject-5.csv","psycho","9","1","Neonatal Nightingale","4.1.8","Algunos piensan que el ","4","2","yes","0","2","NA","2","1","2","NA","2","NA","1935.4023000050802","NA","6518.167799993535","14714.407099992968","1935.4023000050802","NA","7493.552200001432","NA","901","2","psycho","Algunos piensan que el absolutista era un tirano cruel.","Algunos piensan que el ","Algunos piensan que el absolutista era un tirano cruel.","Algunos piensan que el profesional no está capacitado para manejar el proyecto.","121","Algunos piensan que el absolutista era un tirano cruel.","69","125.0","Algunos piensan que el absolutista era un tirano cruel.","1024","2","48000","-16","experiment","1","5","odd","268886.61030000367","270347.8854999994","273333.2369999989","270606.7005999939","absolutista","4","False","121","268886.4958000049","270606.6762999981","268703.99850000103","NA","249021.62410000165","97531.4636999974","273439.19350000215","39199.98000000487","270598.0316000059","268704.049100008","NA","91012.27110000036","6157.073599999421","97531.55519999564","97531.07440000167","267451.11379999435","6157.344100007322","10039.009900006931","249023.06469999894","273439.2541999987","NA","46739.06970000826","39245.056300002034","39200.04359999439","39237.601900007576","268704.01980000315","268704.0399999969","24759.80860000709","268704.06150000053","268165.3743000061","NA","NA","NA","NA","8580.585600007907","268704.0307999996","268877.049799994","NA","268703.8653000054","Sampling_Rate_Experiment","8","34216.31759998854","9","1","1","experimental","250","100","no","1920","cruel.","8","1854.24076156034","100","1728.0","150","993.6325003018515","565.0","515.0","972.0"
"fluyen","suelen","1","2","¿Los cambios suelen ocurrir de forma lenta?","¿La frase describe cómo las cosas cambian naturalmente?","90","True","90","3","3623","3623","white","yes","EyeLogicOne","0","564","0.14","psycho",".","5","1166","Es interesante cómo las cosas suelen cambiar rápidamente sin previo aviso.","psycho","psycho","0","relative","1","NO","undefined","1","YES","undefined","2","32","32","32","0","32","0","33","0","32","32","0","0","0","0","0","32","0","0","32","32","NA","0","0","0","0","32","32","0","32","32","0","0","0","0","0","32","32","0","32","b2","NO","¿Los cambios suelen ocurrir de forma lenta?","Es interesante cómo las cosas suelen cambiar rápidamente sin previo aviso.","Es interesante cómo las cosas suelen cambiar rápidamente sin previo aviso.","Fri Apr 17 16:45:30 2026","Sampling rate","250","False","Sí","EyeLogic_Experiment_ONE.osexp","C:\Users\LabCINC\Documents\Experiments\eyelogicreading\ONE","25","E","20","0","1","278092.61010000773","False","Courier New","False","24","no","black","no","Sí","high","yes","50","50","YES","1080","10","119","YES","357","None","psycho","74","61","36","27","4","0","C:\Users\LabCINC\Documents\Experiments\eyelogicreading\ONE\subject-5.csv","psycho","11","1","Neonatal Nightingale","4.1.8","Es interesante cómo las cosas ","5","2","yes","0","2","NA","2","1","2","NA","2","NA","2015.3518000006443","NA","6518.167799993535","14714.407099992968","2015.3518000006443","NA","7493.552200001432","NA","1166","2","psycho","Es interesante cómo las cosas suelen cambiar rápidamente sin previo aviso.","Es interesante cómo las cosas ","Es interesante cómo las cosas suelen cambiar rápidamente sin previo aviso.","Es interesante cómo las cosas suelen cambiar rápidamente sin previo aviso.","120","Es interesante cómo las cosas fluyen naturalmente en la vida.","256","125.0","Es interesante cómo las cosas suelen cambiar rápidamente sin previo aviso.","1024","2","48000","-16","experiment","1","5","odd","275041.28330000094","270347.8854999994","278092.53829999943","275298.0796000047","suelen","5","False","120","275041.1916000012","275298.03950000496","274857.5098000001","NA","278199.569599994","97531.4636999974","280222.81680000015","39199.98000000487","275291.3489000057","274857.5514999975","NA","91012.27110000036","6157.073599999421","97531.55519999564","97531.07440000167","273447.23790000717","6157.344100007322","10039.009900006931","278201.0845000041","280222.8746000037","NA","46739.06970000826","39245.056300002034","39200.04359999439","39237.601900007576","274857.52330000105","274857.54320000706","24759.80860000709","274857.56380000385","274169.84180000145","NA","NA","NA","NA","8580.585600007907","274857.53389999445","275035.4997999966","NA","274857.4384999956","Sampling_Rate_Experiment","9","36231.66939998919","10","1","1","experimental","250","100","no","1920","aviso.","10","1852.7379486047707","100","1728.0","150","1000.9511225732795","565.0","515.0","972.0"
